Subject,Description
Cannot Login,I reset my password three times but still cannot login to my account.
Payment Failed,My money was deducted but my subscription is still inactive.
Application Crashes,The application crashes whenever I open the dashboard.
Account Locked,My account has been locked after multiple failed login attempts.
Dark Mode Feature,Please add a dark mode option for better usability.
How to Change Email,I want to change the email linked to my account.
Worst Service Ever,I have contacted support five times and still no solution.
Thank You,My issue was resolved quickly. Great support team.
Production Server Down,Our production application is completely unavailable.